<?xml version="1.0" encoding="utf-8"?>
<Parts Group="8025737-X"
	xmlns:xsi= "http://www.w3.org/2001/XMLSchema-instance"
	xsi:noNamespaceSchemaLocation="BOM.xsd">
	
	<Part PartID="8025733">
		<Operation WC="FAB020">
			<Material PartID="8025005" Unit="EA" Qty="1" />
		<Operation WC="FAB030" />
		<Operation WC="FAB040" />	
		</Operation>
	</Part>
	
	<Part PartID="8034879">
		<Operation WC="FAB010">
			<Material PartID="9610200-5" Unit="IN" Qty="1" Size="2.75" />
		<Operation WC="MCH010" />
		<Operation WC="MCH060" />	
		</Operation>
	</Part>

	<Part PartID="8025732-1">
		<Operation WC="FAB010">
			<Material PartID="9610200-5" Unit="IN" Qty="1" Size="2.75" />
		<Operation WC="MCH010" />
		<Operation WC="MCH060" />	
		</Operation>
	</Part>

	<Part PartID="8025737-2">
		<Operation WC="ASY010">
			<Material PartID="8034879" Unit="EA" Qty="1" />
			<Material PartID="8025733" Unit="EA" Qty="1" />
			<Material PartID="1231707" Unit="EA" Qty="2" />
			<Material PartID="1506101" Unit="EA" Qty="2" />
			<Material PartID="1575101" Unit="EA" Qty="2" />
		</Operation>
	</Part>
	
	<Part PartID="8025737-1">
		<Operation WC="ASY010">
			<Material PartID="8025732-1" Unit="EA" Qty="1" />
			<Material PartID="1231707" Unit="EA" Qty="2" />
			<Material PartID="1506101" Unit="EA" Qty="2" />
			<Material PartID="1575101" Unit="EA" Qty="2" />
		</Operation>
	</Part>
	
</Parts>

