<?xml version="1.0" encoding="utf-8"?>
<Parts Group="M-105-X"
	xmlns:xsi= "http://www.w3.org/2001/XMLSchema-instance"
	xsi:noNamespaceSchemaLocation="BOM.xsd">
	
	<Part PartID="8034756">
		<Operation WC="FAB010">
			<Material PartID="9014204-3" Unit="IN" Qty="1" Size="2.500" />
		</Operation>
		<Operation WC="FAB020" />
		<Operation WC="FAB030" />
		<Operation WC="FAB040" />
		<Operation WC="FIN010" />
		<Operation WC="FIN020">
			<Material PartID="9812001" Unit="PT" Qty="1" Size=".0625" />
		</Operation>
	</Part>
	
	<Part PartID="8034025">
		<Operation WC="ASY010">
			<Material PartID="6092091" Unit="EA" Qty="1" />
		</Operation>
		<Operation WC="MCH010" />
		<Operation WC="MCH060" />
	</Part>
	
	<Part PartID="8034022">
		<Operation WC="FAB010">
			<Material PartID="9014406-4" Unit="IN" Qty="1" Size="6.750" />
		</Operation>
		<Operation WC="FAB020" />
		<Operation WC="FAB030" />
		<Operation WC="FAB040" />
		<Operation WC="FAB080" />
		<Operation WC="MCH010" />
		<Operation WC="FIN010" />
		<Operation WC="FIN020">
			<Material PartID="9812001" Unit="PT" Qty="1" Size=".0625" />
		</Operation>
	</Part>
	
	<Part PartID="M-105-X">
		<Operation WC="ASY010">
			<Material PartID="2507201" Unit="EA" Qty="14" />
			<Material PartID="2577201" Unit="EA" Qty="10" />
			<Material PartID="2032001" Unit="EA" Qty="8" />
			<Material PartID="2402006" Unit="EA" Qty="4" />
			<Material PartID="2402004" Unit="EA" Qty="2" />
			<Material PartID="6621013" Unit="EA" Qty="1" />
			<Material PartID="6140008" Unit="EA" Qty="1" />
			<Material PartID="8034023-1" Unit="EA" Qty="1" />
			<Material PartID="1421705" Unit="EA" Qty="4" />
			<Material PartID="1576101" Unit="EA" Qty="4" />
			<Material PartID="7960058" Unit="EA" Qty="1" />
			<Material PartID="7194035" Unit="EA" Qty="1" />
			<Material PartID="7194904" Unit="EA" Qty="1" />
			<Material PartID="5180201" Unit="IN" Qty="1" Size="2.500" />
			<Material PartID="6111009" Unit="EA" Qty="1" />
			<Material PartID="8034025" Unit="EA" Qty="1" />
			<Material PartID="8034022" Unit="EA" Qty="1" />
			<Material PartID="8034756" Unit="EA" Qty="1" />
		</Operation>
	</Part>
	
	<Part PartID="M-105-1">
		<Operation WC="ASY010">
			<Material PartID="M-105-X" Unit="EA" Qty="1" />
			<Material PartID="2402008" Unit="EA" Qty="2" />
			<Material PartID="6140007" Unit="EA" Qty="1" />
			<Material PartID="8026139-158" Unit="EA" Qty="1" />
		</Operation>
	</Part>
	
	<Part PartID="M-105-2">
		<Operation WC="ASY010">
			<Material PartID="M-105-X" Unit="EA" Qty="1" />
			<Material PartID="2402012" Unit="EA" Qty="2" />
			<Material PartID="6140011" Unit="EA" Qty="1" />
			<Material PartID="8026139-1" Unit="EA" Qty="1" />
		</Operation>
	</Part>
	
	<Part PartID="M-105-3">
		<Operation WC="ASY010">
			<Material PartID="M-105-3" Unit="EA" Qty="1" />
			<Material PartID="2402008" Unit="EA" Qty="2" />
			<Material PartID="6140007" Unit="EA" Qty="1" />
			<Material PartID="8026139-159" Unit="EA" Qty="1" />
		</Operation>
	</Part>
	
	<Part PartID="M-105-4">
		<Operation WC="ASY010">
			<Material PartID="M-105-X" Unit="EA" Qty="1" />
			<Material PartID="2402008" Unit="EA" Qty="2" />
			<Material PartID="6140007" Unit="EA" Qty="1" />
			<Material PartID="8026139-135" Unit="EA" Qty="1" />
		</Operation>
	</Part>
	
	<Part PartID="M-105-5">
		<Operation WC="ASY010">
			<Material PartID="M-105-X" Unit="EA" Qty="1" />
			<Material PartID="2402008" Unit="EA" Qty="2" />
			<Material PartID="6140007" Unit="EA" Qty="1" />
			<Material PartID="8026139-160" Unit="EA" Qty="1" />
		</Operation>
	</Part>
	
	<Part PartID="M-105-6">
		<Operation WC="ASY010">
			<Material PartID="M-105-X" Unit="EA" Qty="1" />
			<Material PartID="2402008" Unit="EA" Qty="2" />
			<Material PartID="6140007" Unit="EA" Qty="1" />
			<Material PartID="8026139-157" Unit="EA" Qty="1" />
		</Operation>
	</Part>
	
</Parts>
	