<?xml version="1.0" encoding="utf-8"?>
<Parts Group="M900 Ball Transfers"
	xmlns:xsi= "http://www.w3.org/2001/XMLSchema-instance"
	xsi:noNamespaceSchemaLocation="BOM.xsd">

	<Part PartID="M900"> <!-- clean -->
		<Operation WC="ASY010">
			<Material PartID="8028587" Unit="EA" Qty="1" /> <!-- clean -->
			<Material PartID="8028639" Unit="EA" Qty="1" /> <!-- purchased -->
			<Material PartID="6960015" Unit="EA" Qty="1" /> <!-- purchased -->
			<Material PartID="6960036" Unit="EA" Qty="230" /> <!-- purchased -->
		</Operation>
	</Part>

	<Part PartID="8028587"> <!-- clean -->
		<Operation WC="EXT010">
			<Material PartID="8028587-A" Unit="EA" Qty="1" /> <!-- purchased -->
			<Material PartID="8028587-B" Unit="EA" Qty="1" /> <!-- purchased -->
		</Operation>
	</Part>

</Parts>