<?xml version="1.0" encoding="utf-8"?>
<Parts Group="Model 33M"
	xmlns:xsi= "http://www.w3.org/2001/XMLSchema-instance"
	xsi:noNamespaceSchemaLocation="BOM.xsd">

	<Part PartID="8034376">
		<Operation WC="FAB010">
			<Material PartID="9014406-4" Unit="IN" Qty="1" Size="2.1875" />
		</Operation>
		<Operation WC="FAB020" />
		<Operation WC="FAB030" />
		<Operation WC="FAB040" />
		<Operation WC="MCH010" />
		<Operation WC="FIN010" />
		<Operation WC="FIN020">
			<Material PartID="9812001" Unit="PT" Qty="1" Size="0.0313" />
		</Operation>	
	</Part>
	
	<Part PartID="8034622-1">
		<Operation WC="FAB010">
			<Material PartID="9014204-4" Unit="IN" Qty="1" Size="22" />
		</Operation>
		<Operation WC="FAB020" />
		<Operation WC="FAB030" />
		<Operation WC="FAB040" />
		<Operation WC="FIN010" />
		<Operation WC="FIN020">
			<Material PartID="9812001" Unit="PT" Qty="1" Size="0.0313" />
		</Operation>
	</Part>
	
	<Part PartID="8034622-2">
		<Operation WC="FAB010">
			<Material PartID="9014204-4" Unit="IN" Qty="1" Size="22" />
		</Operation>
		<Operation WC="FAB020" />
		<Operation WC="FAB030" />
		<Operation WC="FAB040" />
		<Operation WC="FIN010" />
		<Operation WC="FIN020">
			<Material PartID="9812001" Unit="PT" Qty="1" Size="0.0313" />
		</Operation>	
	</Part>
	
	<Part PartID="8028312">
		<Operation WC="FAB010">
			<Material PartID="9190201-4" Unit="IN" Qty="1" Size="2.25" />
		</Operation>
		<Operation WC="MCH010" />
		<Operation WC="MCH060" />
	</Part>
	
	<Part PartID="8029125-1">
		<Operation WC="MCH010">
			<Material PartID="5460403" Unit="EA" Qty="1" />
		</Operation>
	</Part>
	
	<Part PartID="8027958">
		<Operation WC="ASY010">
			<Material PartID="8027958" Unit="EA" Qty="1" />
			<Material PartID="8034376" Unit="EA" Qty="1" />
			<Material PartID="8034622-1" Unit="EA" Qty="1" />
			<Material PartID="8034622-2" Unit="EA" Qty="1" />
			<Material PartID="8028312" Unit="EA" Qty="1" />
			<Material PartID="8029125-1" Unit="EA" Qty="1" />
			<Material PartID="5145601" Unit="EA" Qty="3" />
			<Material PartID="5062601" Unit="EA" Qty="1" />
			<Material PartID="5145603" Unit="EA" Qty="3" />
			<Material PartID="5261607" Unit="EA" Qty="1" />
			<Material PartID="5102601-1" Unit="EA" Qty="1" />
			<Material PartID="5462603" Unit="EA" Qty="1" />
			<Material PartID="5262605" Unit="EA" Qty="1" />
			<Material PartID="5144422" Unit="EA" Qty="4" />
			<Material PartID="5102501" Unit="EA" Qty="1" />
			<Material PartID="5144421" Unit="EA" Qty="1" />
			<Material PartID="5424604" Unit="IN" Qty="96" />
			<Material PartID="5424404" Unit="IN" Qty="96" />
			<Material PartID="5462502" Unit="EA" Qty="1" />
			<Material PartID="5144623" Unit="EA" Qty="1" />
			<Material PartID="5262503" Unit="EA" Qty="1" />
			<Material PartID="5015404" Unit="EA" Qty="1" />
			<Material PartID="5262401" Unit="EA" Qty="1" />
			<Material PartID="5132501" Unit="EA" Qty="1" />
			<Material PartID="5302402" Unit="EA" Qty="1" />
			<Material PartID="5032502" Unit="EA" Qty="1" />
			<Material PartID="5406402" Unit="EA" Qty="1" />
			<Material PartID="5116201" Unit="EA" Qty="1" />
			<Material PartID="6583031" Unit="EA" Qty="1" />
			<Material PartID="5320007" Unit="EA" Qty="1" />
			<Material PartID="5130401" Unit="EA" Qty="1" />
			<Material PartID="5131003" Unit="EA" Qty="1" />
			<Material PartID="5180603" Unit="IN" Qty="60" />
			<Material PartID="5106501" Unit="EA" Qty="1" />
			<Material PartID="5033602" Unit="EA" Qty="1" />
			<Material PartID="5144427" Unit="EA" Qty="1" />
			<Material PartID="5144622" Unit="EA" Qty="3" />
			<Material PartID="5144621" Unit="EA" Qty="2" />
			<Material PartID="5112601" Unit="EA" Qty="1" />
			<Material PartID="5262601" Unit="EA" Qty="1" />
			<Material PartID="2547401" Unit="EA" Qty="8" />
			<Material PartID="6710011" Unit="EA" Qty="4" />
			<Material PartID="7352034" Unit="EA" Qty="1" />
			<Material PartID="5141001" Unit="EA" Qty="8" />
			<Material PartID="5141003" Unit="EA" Qty="8" />
			<Material PartID="2231706" Unit="EA" Qty="1" />
			<Material PartID="2516101" Unit="EA" Qty="1" />
			<Material PartID="2606101" Unit="EA" Qty="1" />
			<Material PartID="2001701" Unit="EA" Qty="1" />
			<Material PartID="2402816" Unit="EA" Qty="4" />
			<Material PartID="2507401" Unit="EA" Qty="8" />
			<Material PartID="2577401" Unit="EA" Qty="4" />
			<Material PartID="2032801" Unit="EA" Qty="4" />
			<Material PartID="2402410" Unit="EA" Qty="4" />
			<Material PartID="2517301" Unit="EA" Qty="4" />
			<Material PartID="2507301" Unit="EA" Qty="4" />
			<Material PartID="2577301" Unit="EA" Qty="4" />
			<Material PartID="2002401" Unit="EA" Qty="4" />
		</Operation>
	</Part>
	
</Parts>
	
	